 <!ELEMENT student (cpism_students*)>
     <!ELEMENT cpism_students (name, age, address)>
      <!ELEMENT name (#PCDATA)>
       <!ELEMENT age (#PCDATA)>
       <!ELEMENT address (#PCDATA)>