<?xml version="1.0" encoding="UTF-8"?>

<!DOCTYPE student SYSTEM "data.dtd" [
    

    <!ATTLIST cpism_students id CDATA #REQUIRED>




    <!ENTITY a "Aptech">

]>

<student>

<cpism_students id="1"> 

<name>&a;</name>
<age>16</age>
<address>Karachi</address>

</cpism_students>


<cpism_students id="2"> 

<name>Ali</name>
<age>16</age>
<address>Karachi</address>

</cpism_students>




</student>
